84',substitution,Substitution sub-out Lenny Nangis sub-in Farid Boulaya .
80',substitution,Substitution sub-out Ronael Pierre-Gabriel sub-in Pierre-Yves Polomat .
77',yellow-card,Yellow Card Benjamin Corgnet .
70',yellow-card,Yellow Card Gaël Danic.
65',red-card,Red Card Fabien Lemoine.
62',substitution,Substitution sub-out Jorginho Intima sub-in Benjamin Corgnet  .
45' + 2',substitution,Substitution sub-out Florian Raspentino sub-in Lindsay Rose .
45' + 2',substitution,Substitution sub-out Vincent Pajot sub-in Fabien Lemoine .
44',red-card,Red Card Nicolas Saint-Ruf.
