90' + 2',substitution,Substitution sub-out Mikhail Rosheuvel sub-in Farshad Noor .
88',substitution,Substitution sub-out Nacer Barazite sub-in Sean Klaiber .
85',substitution,Substitution sub-out Marcos Gullón sub-in Dani Schahin .
82',yellow-card,Yellow Card Tom Van Hyfte.
78',substitution,Substitution sub-out Nestor Mytides sub-in Mitchell Paulissen .
53',substitution,Substitution sub-out Darren Etto Rosheuvel sub-in Andreas Ludwig .
29',substitution,Substitution sub-out Willem Janssen sub-in Giovanni Troupée .
