90' + 1',substitution,Substitution sub-out Denis Iguma sub-in Moses Oloya .
89',assist,Assist Mohamed Salah.
89',goal,Goal Abdalla El Said.
81',substitution,Substitution sub-out Farouq Miya sub-in Nicholas Wadada .
79',substitution,Substitution sub-out Mahmoud Hassan sub-in Mahmoud Abdul Monem .
66',substitution,Substitution sub-out Ramadan Sobhi sub-in Amr Warda .
59',substitution,Substitution sub-out Tarek Hamed sub-in Abdalla El Said .
24',yellow-card,Yellow Card Tarek Hamed.
