83',yellow-card,Yellow Card O. Vizcarrondo.
82',substitution,Substitution Koffi Djidji Abdoulaye Touré .
78',substitution,Substitution N. de Préville M. Terrier  .
71',substitution,Substitution Yassine Benzia Morgan Amalfitano .
66',substitution,Substitution Nickolaj Thomsen Jules Iloki .
65',substitution,Substitution Mounir Obbadi Yves Bissouma .
57',substitution,Substitution Yacine Bammou Amine Harit .
52',yellow-card,Yellow Card Yassine Benzia.
43',yellow-card,Yellow Card Mounir Obbadi.
